source,id,title,authors,year,doi,url,venue,abstract,match_mv_abs,match_wean_abs,match_rl_abs,decision
openalex,https://openalex.org/W2962676505,A Reinforcement Learning Approach to Weaning of Mechanical Ventilation in Intensive Care Units,Niranjani Prasad; Li Cheng; Corey Chivers; Michael Draugelis; Barbara E. Engelhardt,2017,10.48550/arxiv.1704.06300,https://doi.org/10.48550/arxiv.1704.06300,,"The management of invasive mechanical ventilation, and the regulation of sedation and analgesia during ventilation, constitutes a major part of the care of patients admitted to intensive care units. Both prolonged dependence on mechanical ventilation and premature extubation are associated with increased risk of complications and higher hospital costs, but clinical opinion on the best protocol for weaning patients off of a ventilator varies. This work aims to develop a decision support tool that uses available patient information to predict time-to-extubation readiness and to recommend a personalized regime of sedation dosage and ventilator support. To this end, we use off-policy reinforcement learning algorithms to determine the best action at a given patient state from sub-optimal historical ICU data. We compare treatment policies from fitted Q-iteration with extremely randomized trees and with feedforward neural networks, and demonstrate that the policies learnt show promise in recommending weaning protocols with improved outcomes, in terms of minimizing rates of reintubation and regulating physiological stability.",True,True,True,keep
openalex,https://openalex.org/W3159123674,Prediction of weaning from mechanical ventilation using Convolutional Neural Networks,Yan Jia; Chaitanya Kaul; Tom Lawton; Roderick Murray‐Smith; Ibrahim Habli,2021,10.1016/j.artmed.2021.102087,https://doi.org/10.1016/j.artmed.2021.102087,,,False,False,False,keep_no_abstract
google_scholar,https://arxiv.org/abs/1704.06300,A reinforcement learning approach to weaning of mechanical ventilation in intensive care units,N Prasad; LF Cheng; C Chivers; M Draugelis,2017,,https://arxiv.org/abs/1704.06300,,,False,False,False,keep_no_abstract
google_scholar,https://link.springer.com/article/10.1186/s12911-019-0763-6,Inverse reinforcement learning for intelligent mechanical ventilation and sedative dosing in intensive care units,J Liu,2019,,https://link.springer.com/article/10.1186/s12911-019-0763-6,,,False,False,False,keep_no_abstract
google_scholar,https://www.jmir.org/2024/1/e44494/,Reinforcement learning to optimize ventilator settings for patients on invasive mechanical ventilation: retrospective study,Q Xu; X Sun; G Xie; M Feng,2024,,https://www.jmir.org/2024/1/e44494/,,,False,False,False,keep_no_abstract
google_scholar,https://www.nature.com/articles/s41746-021-00388-6,Development and validation of a reinforcement learning algorithm to dynamically optimize mechanical ventilation in critical care,A Peine; A Hallawa; G Dartmann,2021,,https://www.nature.com/articles/s41746-021-00388-6,,,False,False,False,keep_no_abstract
google_scholar,https://www.research-collection.ethz.ch/handle/20.500.11850/473932,Weaning of Mechanically Ventilated Patients in the Intensive Care Unit: A Clinician-in-the-Loop Reinforcement Learning Approach,NE Rüegsegger,2021,,https://www.research-collection.ethz.ch/handle/20.500.11850/473932,,,False,False,False,keep_no_abstract
google_scholar,https://www.mdpi.com/2077-0383/13/5/1505,"Using artificial intelligence to predict mechanical ventilation weaning success in patients with respiratory failure, including those with acute respiratory distress …",D Padawer,2024,,https://www.mdpi.com/2077-0383/13/5/1505,,,False,False,False,keep_no_abstract
google_scholar,https://arxiv.org/abs/2404.03105,Methodology for Interpretable Reinforcement Learning for Optimizing Mechanical Ventilation,JS Lee; M Mahendra; A Aswani,2024,,https://arxiv.org/abs/2404.03105,,,False,False,False,keep_no_abstract
google_scholar,https://ia.intanes.org/pdf/P1.pdf,Development and validation of a reinforcement learning algorithm to dynamically optimize mechanical ventilation in patients with moderate-severe acute …,H Li; J Huo; MSY Liu; Z Li; A Hu,2024,,https://ia.intanes.org/pdf/P1.pdf,,,False,False,False,keep_no_abstract
google_scholar,https://link.springer.com/article/10.1007/s42242-018-0030-1,The efficacy and effectiveness of machine learning for weaning in mechanically ventilated patients at the intensive care unit: a systematic review,GW Colopy; A Ercole,2019,,https://link.springer.com/article/10.1007/s42242-018-0030-1,,,False,False,False,keep_no_abstract
google_scholar,https://arxiv.org/abs/2102.06779,Machine learning for mechanical ventilation control,D Suo; N Agarwal; X Chen; U Ghai,2021,,https://arxiv.org/abs/2102.06779,,,False,False,False,keep_no_abstract
google_scholar,https://www.nature.com/articles/s41746-023-00893-w,Development and validation of a reinforcement learning model for ventilation control during emergence from general anesthesia,H Lee; HK Yoon; J Kim,2023,,https://www.nature.com/articles/s41746-023-00893-w,,,False,False,False,keep_no_abstract
google_scholar,https://www.tandfonline.com/doi/abs/10.2147/IJGM.S515170,Advances in Machine Learning for Mechanically Ventilated Patients,Y Xu; J Xue; Y Deng; L Tu; Y Ding…,2025,,https://www.tandfonline.com/doi/abs/10.2147/IJGM.S515170,,,False,False,False,keep_no_abstract
google_scholar,https://ieeexplore.ieee.org/abstract/document/11121131/,Matching-Based Off-Policy Evaluation for Reinforcement Learning Applied to Mechanical Ventilation,JS Lee; M Mahendra; A Aswani,2025,,https://ieeexplore.ieee.org/abstract/document/11121131/,,,False,False,False,keep_no_abstract
google_scholar,https://arxiv.org/abs/2506.14375,IntelliLung: Advancing Safe Mechanical Ventilation using Offline RL with Hybrid Actions and Clinically Aligned Rewards,MH Yousuf; S Vahdati,2025,,https://arxiv.org/abs/2506.14375,,,False,False,False,keep_no_abstract
google_scholar,https://ieeexplore.ieee.org/abstract/document/10122152/,Reinforcement learning model for managing noninvasive ventilation switching policy,Q Pan,2023,,https://ieeexplore.ieee.org/abstract/document/10122152/,,,False,False,False,keep_no_abstract
google_scholar,https://medinform.jmir.org/2025/1/e64592,Prediction of Spontaneous Breathing Trial Outcome in Critically Ill-Ventilated Patients Using Deep Learning: Development and Verification Study,HC Yang; ATH Hao; SC Liu; YC Chang…,2025,,https://medinform.jmir.org/2025/1/e64592,,,False,False,False,keep_no_abstract
google_scholar,https://link.springer.com/article/10.1186/s12911-020-1120-5,Supervised-actor-critic reinforcement learning for intelligent mechanical ventilation and sedative dosing in intensive care units,Y Dong,2020,,https://link.springer.com/article/10.1186/s12911-020-1120-5,,,False,False,False,keep_no_abstract
google_scholar,https://www.mdpi.com/2306-5354/10/10/1163,Development of a machine learning model for predicting weaning outcomes based solely on continuous ventilator parameters during spontaneous breathing …,DY Kim,2023,,https://www.mdpi.com/2306-5354/10/10/1163,,,False,False,False,keep_no_abstract
google_scholar,https://www.researchsquare.com/article/rs-2146974/latest,Reinforcement learning to help intensivists optimize mechanical ventilation settings (EZ-Vent): Derivation and validation using large databases,X Sun; G Xie; M Feng; KC See,2022,,https://www.researchsquare.com/article/rs-2146974/latest,,,False,False,False,keep_no_abstract
google_scholar,https://jscholarship.library.jhu.edu/items/3a79c52f-7b62-4d39-97dd-dbe51ddb3d19,Intelligent Patient Management and Control,X Zhang,2025,,https://jscholarship.library.jhu.edu/items/3a79c52f-7b62-4d39-97dd-dbe51ddb3d19,,,False,False,False,keep_no_abstract
google_scholar,https://www.sciencedirect.com/science/article/pii/S1036731425000335,Harnessing machine learning for predicting successful weaning from mechanical ventilation: A systematic review,FR Ahmed; N Al-Yateem; SA Nejadghaderi,2025,,https://www.sciencedirect.com/science/article/pii/S1036731425000335,,,False,False,False,keep_no_abstract
google_scholar,https://www.sciencedirect.com/science/article/pii/S0933365721000804,Prediction of weaning from mechanical ventilation using convolutional neural networks,Y Jia; C Kaul; T Lawton; R Murray-Smith,2021,,https://www.sciencedirect.com/science/article/pii/S0933365721000804,,,False,False,False,keep_no_abstract
google_scholar,https://ieeexplore.ieee.org/abstract/document/10935822/,Improving Patient-ventilator Synchrony during Pressure Support Ventilation based on Reinforcement Learning Algorithm,L Hao; X Wang; S Ren; Y Shi; M Cai…,2025,,https://ieeexplore.ieee.org/abstract/document/10935822/,,,False,False,False,keep_no_abstract
google_scholar,https://www.jmir.org/2020/7/e18477/,Reinforcement learning for clinical decision support in critical care: comprehensive review,S Liu; KC See; KY Ngiam; LA Celi; X Sun,2020,,https://www.jmir.org/2020/7/e18477/,,,False,False,False,keep_no_abstract
google_scholar,https://www.frontiersin.org/journals/medicine/articles/10.3389/fmed.2025.1597556/abstract,Artificial intelligence and machine learning in acute respiratory distress syndrome management: recent advances,J Luo,2025,,https://www.frontiersin.org/journals/medicine/articles/10.3389/fmed.2025.1597556/abstract,,,False,False,False,keep_no_abstract
google_scholar,https://www.jmir.org/2025/1/e63847/,Optimizing Vital Signs in Patients With Traumatic Brain Injury: Reinforcement Learning Algorithm Development and Validation,H Zhang; M Diao; S Zhang; P Ni; W Zhang; C Wu…,2025,,https://www.jmir.org/2025/1/e63847/,,,False,False,False,keep_no_abstract
google_scholar,https://ieeexplore.ieee.org/abstract/document/10313431/,Reinforcement learning approach to sedation and delirium management in the intensive care unit,N Eghbali; T Alhanai,2023,,https://ieeexplore.ieee.org/abstract/document/10313431/,,,False,False,False,keep_no_abstract
google_scholar,https://arxiv.org/abs/2003.06474,Optimizing medical treatment for sepsis in intensive care: from reinforcement learning to pre-trial evaluation,L Li; I Albert-Smet; AA Faisal,2003,,https://arxiv.org/abs/2003.06474,,,False,False,False,keep_no_abstract
google_scholar,https://ieeexplore.ieee.org/abstract/document/10439998/,A reinforcement learning model for optimal treatment strategies in intensive care: assessment of the role of cardiorespiratory features,C Drudi; M Mollura; HL Li-wei,2024,,https://ieeexplore.ieee.org/abstract/document/10439998/,,,False,False,False,keep_no_abstract
google_scholar,https://arxiv.org/abs/2110.10994,Interpretable machine learning for resource allocation with application to ventilator triage,J Grand-Clément; C Chan; V Goyal,2021,,https://arxiv.org/abs/2110.10994,,,False,False,False,keep_no_abstract
google_scholar,https://ojs.aaai.org/index.php/AAAI/article/view/35013,Distribution-Free Uncertainty Quantification in Mechanical Ventilation Treatment: A Conformal Deep Q-Learning Framework,N Eghbali; T Alhanai; MM Ghassemi,2025,,https://ojs.aaai.org/index.php/AAAI/article/view/35013,,,False,False,False,keep_no_abstract
google_scholar,https://dspace.mit.edu/handle/1721.1/123126,Predicting optimal sedation control with reinforcement learning,A Vajapey,2019,,https://dspace.mit.edu/handle/1721.1/123126,,,False,False,False,keep_no_abstract
google_scholar,https://ieeexplore.ieee.org/abstract/document/10781564/,Reinforcement Learning for Heart Failure Treatment Optimization in the Intensive Care Unit,C Drudi; M Mollura; A Pace,2024,,https://ieeexplore.ieee.org/abstract/document/10781564/,,,False,False,False,keep_no_abstract
google_scholar,https://link.springer.com/chapter/10.1007/978-3-031-15644-1_2,Deep learning-based prediction of mechanical ventilation reintubation in intensive care units,X Xie,2022,,https://link.springer.com/chapter/10.1007/978-3-031-15644-1_2,,,False,False,False,keep_no_abstract
google_scholar,https://pubsonline.informs.org/doi/abs/10.1287/mnsc.2021.01427,Extubation Decisions with Predictive Information for Mechanically Ventilated Patients in the ICU,G Cheng; J Xie; Z Zheng,2025,,https://pubsonline.informs.org/doi/abs/10.1287/mnsc.2021.01427,,,False,False,False,keep_no_abstract
google_scholar,https://medinform.jmir.org/2022/3/e28781,State of the art of machine learning–enabled clinical decision support in intensive care units: literature review,N Hong,2022,,https://medinform.jmir.org/2022/3/e28781,,,False,False,False,keep_no_abstract
google_scholar,https://jamanetwork.com/journals/jama/article-abstract/2831858,Optimal vasopressin initiation in septic shock: the OVISS reinforcement learning study,JN Kennedy; J Feng; H Singh; S Saria,2025,,https://jamanetwork.com/journals/jama/article-abstract/2831858,,,False,False,False,keep_no_abstract
google_scholar,https://www.liebertpub.com/doi/abs/10.4187/respcare.07500,Monitoring big data during mechanical ventilation in the ICU,CD Smallwood,2020,,https://www.liebertpub.com/doi/abs/10.4187/respcare.07500,,,False,False,False,keep_no_abstract
google_scholar,https://www.mdpi.com/2075-4426/12/3/501,A simple algorithm using ventilator parameters to predict successfully rapid weaning program in cardiac intensive care unit patients,WT Chen; HL Huang; PS Ko; W Su; CC Kao…,2022,,https://www.mdpi.com/2075-4426/12/3/501,,,False,False,False,keep_no_abstract
google_scholar,https://journals.sagepub.com/doi/abs/10.1177/29768675241298918,Artificial Intelligence for Mechanical Ventilation: A Transformative Shift in Critical Care,G Cuttone,2024,,https://journals.sagepub.com/doi/abs/10.1177/29768675241298918,,,False,False,False,keep_no_abstract
google_scholar,https://pmc.ncbi.nlm.nih.gov/articles/PMC12194786/,Machine Learning and Artificial Intelligence in Intensive Care Medicine: Critical Recalibrations from Rule-Based Systems to Frontier Models,A Niset; M Salvagno,2025,,https://pmc.ncbi.nlm.nih.gov/articles/PMC12194786/,,,False,False,False,keep_no_abstract
google_scholar,https://arxiv.org/abs/2505.21596,Learning optimal treatment strategies for intraoperative hypotension using deep reinforcement learning,E Adiyeke,2025,,https://arxiv.org/abs/2505.21596,,,False,False,False,keep_no_abstract
google_scholar,https://journals.lww.com/arwy/fulltext/2023/06010/predictive_machine_learning_algorithms_in.2.aspx,Predictive machine learning algorithms in anticipating problems with airway management,M Senthilnathan; P Kundra,2023,,https://journals.lww.com/arwy/fulltext/2023/06010/predictive_machine_learning_algorithms_in.2.aspx,,,False,False,False,keep_no_abstract
google_scholar,https://dl.acm.org/doi/abs/10.1145/3643856,Optimal treatment strategies for critical patients with deep reinforcement learning,X Tao; L Li; H Xie; T Cai; J Yong,2024,,https://dl.acm.org/doi/abs/10.1145/3643856,,,False,False,False,keep_no_abstract
google_scholar,https://iopscience.iop.org/article/10.1088/1361-6501/acc11e/meta,Mechanical ventilation intervention based on machine learning from vital signs monitoring: a scoping review,MR Baidillah; R Riyanto,2023,,https://iopscience.iop.org/article/10.1088/1361-6501/acc11e/meta,,,False,False,False,keep_no_abstract
google_scholar,https://link.springer.com/article/10.1186/s40635-025-00791-3,Artificial intelligence-driven decision support for patients with acute respiratory failure: a scoping review,T Pham; M Miller,2025,,https://link.springer.com/article/10.1186/s40635-025-00791-3,,,False,False,False,keep_no_abstract
google_scholar,https://link.springer.com/chapter/10.1007/978-3-032-06118-8_18,Offline Reinforcement Learning for Community-Acquired Pneumonia Management: A Feasibility Study,A Beeson; K Couper; G Montana,2025,,https://link.springer.com/chapter/10.1007/978-3-032-06118-8_18,,,False,False,False,keep_no_abstract
google_scholar,https://ieeexplore.ieee.org/abstract/document/10081849/,Optimal fluid and vasopressor interventions in septic icu patients through reinforcement learning model,M Mollura; C Drudi; L Lehman,2022,,https://ieeexplore.ieee.org/abstract/document/10081849/,,,False,False,False,keep_no_abstract
google_scholar,https://journals.plos.org/plosone/article?id=10.1371/journal.pone.0299653,"Machine learning algorithm for ventilator mode selection, pressure and volume control",T Anitha; G Gopu; P Arun Mozhi Devan,2024,,https://journals.plos.org/plosone/article?id=10.1371/journal.pone.0299653,,,False,False,False,keep_no_abstract
google_scholar,https://www.mdpi.com/2306-5354/8/5/60,Mechanical ventilator parameter estimation for lung health through machine learning,SS Oruganti Venkata,2021,,https://www.mdpi.com/2306-5354/8/5/60,,,False,False,False,keep_no_abstract
google_scholar,https://arxiv.org/abs/2508.21101,Beyond Prediction: Reinforcement Learning as the Defining Leap in Healthcare AI,D Perera; G Habib; Q Xu; DJ Tan; K He,2025,,https://arxiv.org/abs/2508.21101,,,False,False,False,keep_no_abstract
google_scholar,https://www.researchgate.net/profile/Cheng-Guang/publication/343675248_Extubation_Decisions_with_Predictive_Information_for_Mechanically_Ventilated_Patients_in_ICU/links/609c1c8a299bf1a931317c07/Extubation-Decisions-with-Predictive-Information-for-Mechanically-Ventilated-Patients-in-ICU.pdf,Extubation decision making with predictive information for mechanically ventilated patients in ICU,G Cheng; J Xie; Z Zheng,2019,,https://www.researchgate.net/profile/Cheng-Guang/publication/343675248_Extubation_Decisions_with_Predictive_Information_for_Mechanically_Ventilated_Patients_in_ICU/links/609c1c8a299bf1a931317c07/Extubation-Decisions-with-Predictive-Information-for-Mechanically-Ventilated-Patients-in-ICU.pdf,,,False,False,False,keep_no_abstract
google_scholar,https://arxiv.org/abs/2510.01508,Realistic CDSS Drug Dosing with End-to-end Recurrent Q-learning for Dual Vasopressor Control,WY Zou; J Feng; JY Zhang,2025,,https://arxiv.org/abs/2510.01508,,,False,False,False,keep_no_abstract
google_scholar,https://www.sciencedirect.com/science/article/pii/S0039606020308254,Reinforcement learning in surgery,S Datta; Y Li; MM Ruppert; Y Ren; B Shickel,2021,,https://www.sciencedirect.com/science/article/pii/S0039606020308254,,,False,False,False,keep_no_abstract
google_scholar,https://link.springer.com/article/10.1007/s11431-020-1778-8,Mechanical ventilation strategy for pulmonary rehabilitation based on patient-ventilator interaction,S Ren,2021,,https://link.springer.com/article/10.1007/s11431-020-1778-8,,,False,False,False,keep_no_abstract
google_scholar,https://www.mdpi.com/2306-5354/10/4/418,A comparative study on predication of appropriate mechanical ventilation mode through machine learning approach,HA Al-Lohedan,2023,,https://www.mdpi.com/2306-5354/10/4/418,,,False,False,False,keep_no_abstract
google_scholar,https://www.medrxiv.org/content/10.1101/2024.01.23.24301516.abstract,A comprehensive ml-based respiratory monitoring system for physiological monitoring & resource planning in the icu,M Hüser; X Lyu; A Pace; S Hyland,2024,,https://www.medrxiv.org/content/10.1101/2024.01.23.24301516.abstract,,,False,False,False,keep_no_abstract
google_scholar,https://ejournal.idsrg.id/index.php/phml/article/view/9,Robust Off-Policy Evaluation of Reinforcement Learning for Sepsis Treatment: A Diagnostic Framework Using Observational Clinical Data,OY Caesarizky; TAP Nagara…,2025,,https://ejournal.idsrg.id/index.php/phml/article/view/9,,,False,False,False,keep_no_abstract
google_scholar,https://publications.ersnet.org/content/erjor/8/2/00016-2022.abstract,ERS international congress 2021: highlights from the respiratory intensive care assembly,C Ribeiro; C Fisser,2022,,https://publications.ersnet.org/content/erjor/8/2/00016-2022.abstract,,,False,False,False,keep_no_abstract
google_scholar,https://www.researchgate.net/profile/Hassan-Ali-293/publication/389137789_Reinforcement_Learning_in_Healthcare_Optimizing_Treatment_Strategies_Dynamic_Resource_Allocation_and_Adaptive_Clinical_Decision-Making/links/67b686a1207c0c20fa8e8fe2/Reinforcement-Learning-in-Healthcare-Optimizing-Treatment-Strategies-Dynamic-Resource-Allocation-and-Adaptive-Clinical-Decision-Making.pdf,"Reinforcement learning in healthcare: optimizing treatment strategies, dynamic resource allocation, and adaptive clinical decision-making",H Ali,2022,,https://www.researchgate.net/profile/Hassan-Ali-293/publication/389137789_Reinforcement_Learning_in_Healthcare_Optimizing_Treatment_Strategies_Dynamic_Resource_Allocation_and_Adaptive_Clinical_Decision-Making/links/67b686a1207c0c20fa8e8fe2/Reinforcement-Learning-in-Healthcare-Optimizing-Treatment-Strategies-Dynamic-Resource-Allocation-and-Adaptive-Clinical-Decision-Making.pdf,,,False,False,False,keep_no_abstract
google_scholar,https://proceedings.mlr.press/v68/raghu17a,Continuous state-space models for optimal sepsis treatment: a deep reinforcement learning approach,A Raghu; M Komorowski; LA Celi,2017,,https://proceedings.mlr.press/v68/raghu17a,,,False,False,False,keep_no_abstract
google_scholar,https://ieeexplore.ieee.org/abstract/document/9871055/,A reinforcement learning application for optimal fluid and vasopressor interventions in septic icu patients,M Mollura; C Drudi; LW Lehman,2022,,https://ieeexplore.ieee.org/abstract/document/9871055/,,,False,False,False,keep_no_abstract
google_scholar,https://search.proquest.com/openview/b92a52381f6e0093571a3a79fff298f2/1?pq-origsite=gscholar&cbl=18750&diss=y,Advancing Statistical Learning and Decision Modeling Using Irregularly-sampled Multivariate Data for Managing Respiratory Diseases,M Alimohammadi,2022,,https://search.proquest.com/openview/b92a52381f6e0093571a3a79fff298f2/1?pq-origsite=gscholar&cbl=18750&diss=y,,,False,False,False,keep_no_abstract
google_scholar,https://www.frontiersin.org/journals/digital-health/articles/10.3389/fdgth.2024.1502434/full,Artificial intelligence in respiratory care,M Karthika; JK Sreedharan; M Shevade,2024,,https://www.frontiersin.org/journals/digital-health/articles/10.3389/fdgth.2024.1502434/full,,,False,False,False,keep_no_abstract
google_scholar,https://openreview.net/forum?id=2lKGfAyKZ7,Reinforcement learning-based decision-making for renal replacement therapy in ICU-acquired AKI patients,M Xiong; T Shi; H Xu,2024,,https://openreview.net/forum?id=2lKGfAyKZ7,,,False,False,False,keep_no_abstract
google_scholar,https://ir.lib.ncu.edu.tw:444/thesis/view_etd.asp?URN=109826011&fileName=GC109826011.pdf,深度 Q 學習用於尋找最佳拔管時機,YH Chien,2022,,https://ir.lib.ncu.edu.tw:444/thesis/view_etd.asp?URN=109826011&fileName=GC109826011.pdf,,,False,False,False,keep_no_abstract
google_scholar,https://luckiligent.github.io/assets/files/FERRY.pdf,Federated Reinforcement Learning for Therapeutic Interventions over ICUs with Noisy Labels,L Cao; Y Zhu; S Tan,2025,,https://luckiligent.github.io/assets/files/FERRY.pdf,,,False,False,False,keep_no_abstract
google_scholar,https://search.proquest.com/openview/7c16d8343945998af38909d2732fff1f/1?pq-origsite=gscholar&cbl=18750&diss=y,"Intelligent, Multi-Modal Critical Care: Molecular Profiling and Reinforcement Learning",P Jayaraman,2025,,https://search.proquest.com/openview/7c16d8343945998af38909d2732fff1f/1?pq-origsite=gscholar&cbl=18750&diss=y,,,False,False,False,keep_no_abstract
google_scholar,https://onlinelibrary.wiley.com/doi/abs/10.1155/2021/6657119,Reinforcement learning in neurocritical and neurosurgical care: principles and possible applications,N Qiao,2021,,https://onlinelibrary.wiley.com/doi/abs/10.1155/2021/6657119,,,False,False,False,keep_no_abstract
google_scholar,https://link.springer.com/chapter/10.1007/978-3-031-20627-6_11,Learning optimal treatment strategies for sepsis using offline reinforcement learning in continuous space,Z Wang,2022,,https://link.springer.com/chapter/10.1007/978-3-031-20627-6_11,,,False,False,False,keep_no_abstract
google_scholar,https://dl.acm.org/doi/abs/10.1145/3368555.3384450,Defining admissible rewards for high-confidence policy evaluation in batch reinforcement learning,N Prasad; B Engelhardt; F Doshi-Velez,2020,,https://dl.acm.org/doi/abs/10.1145/3368555.3384450,,,False,False,False,keep_no_abstract
google_scholar,https://www.sciencedirect.com/science/article/pii/S0007091221007431,Is artificial intelligence ready to solve mechanical ventilation? Computer says blow,DC Marshall; M Komorowski,2022,,https://www.sciencedirect.com/science/article/pii/S0007091221007431,,,False,False,False,keep_no_abstract
google_scholar,https://www.mdpi.com/2306-5354/9/11/701,Toward evaluating critical factors of extubation outcome with XCSR-generated rules,PH Huang; LY Chen; TC Hsiao,2022,,https://www.mdpi.com/2306-5354/9/11/701,,,False,False,False,keep_no_abstract
google_scholar,https://arxiv.org/abs/1805.12298,Evaluating reinforcement learning algorithms in observational health settings,O Gottesman; F Johansson; J Meier; J Dent,2018,,https://arxiv.org/abs/1805.12298,,,False,False,False,keep_no_abstract
google_scholar,http://all.cs.umass.edu/pubs/2018/Jagannatha%20et%20al%20-%20Towards%20High%20Confidence.pdf,Towards high confidence off-policy reinforcement learning for clinical applications,A Jagannatha; P Thomas; H Yu,2018,,http://all.cs.umass.edu/pubs/2018/Jagannatha%20et%20al%20-%20Towards%20High%20Confidence.pdf,,,False,False,False,keep_no_abstract
google_scholar,https://www.nature.com/articles/s41746-024-01316-0,A primer on reinforcement learning in medicine for clinicians,P Jayaraman; J Desman; M Sabounchi,2024,,https://www.nature.com/articles/s41746-024-01316-0,,,False,False,False,keep_no_abstract
google_scholar,https://amulyayadav.github.io/AI4SG2023/images/34.pdf,NurSpecialist: Duel-Agent Reinforcement Learning for Dynamic Hospitalised Intervention Regimes using Electronic Health Records,Z Luo; P Watkinson; T Zhu,2022,,https://amulyayadav.github.io/AI4SG2023/images/34.pdf,,,False,False,False,keep_no_abstract
